{
  "schemaVersion": "1.0",
  "manifestKind": "backend-native",
  "version": "v0.1.0",
  "generatedAt": "2026-06-08T00:00:00Z",
  "root": {
    "repository": "xxldm/hdx",
    "ref": "refs/tags/v0.1.0",
    "commit": "1111111111111111111111111111111111111111"
  },
  "backend": {
    "repository": "xxldm/hdx-backend",
    "commit": "2222222222222222222222222222222222222222",
    "sourceVisibility": "private"
  },
  "githubActions": {
    "workflow": "backend-native.yml",
    "runId": 1,
    "runAttempt": 1,
    "artifactName": "hdx-backend-native-v0.1.0"
  },
  "openapiSnapshotHash": "aaaaaaaaaaaaaaaaaaaaaaaaaaaaaaaaaaaaaaaaaaaaaaaaaaaaaaaaaaaaaaaa",
  "forbiddenFilesScan": {
    "status": "passed",
    "scannerVersion": "release-manifest-check.ps1",
    "checkedPatterns": [
      "source",
      "jar-war-class"
    ]
  },
  "artifacts": [
    {
      "kind": "backend-full",
      "platform": "windows-x64",
      "fileName": "hdx-backend-full-windows-x64-v0.1.0.zip",
      "packaging": "zip",
      "sha256": "bbbbbbbbbbbbbbbbbbbbbbbbbbbbbbbbbbbbbbbbbbbbbbbbbbbbbbbbbbbbbbbb",
      "sizeBytes": 1,
      "entrypoints": [
        "bin/hdx-backend-full.exe"
      ]
    }
  ]
}
